{
 "schema": 1,
 "updated": "2026-10-22",
 "upstream": {
  "repo": "https://github.com/immortalwrt/luci",
  "branch": "openwrt-24.10",
  "commit": "7f9ad99d611a7548125e73b7e375b6d1793ca1ef"
 },
 "categories": [
  {
   "id": "代理",
   "order": 1,
   "keywords": "科学 上网 翻墙 梯子 分流 订阅 节点"
  },
  {
   "id": "DNS 与广告",
   "order": 2,
   "keywords": "去广告 屏蔽 广告 解析 防污染"
  },
  {
   "id": "网络",
   "order": 3,
   "keywords": "路由 拨号 负载 限速 唤醒 校园网"
  },
  {
   "id": "VPN 与穿透",
   "order": 4,
   "keywords": "内网穿透 远程 异地组网 回家 vpn"
  },
  {
   "id": "服务",
   "order": 5,
   "keywords": ""
  },
  {
   "id": "存储",
   "order": 6,
   "keywords": "网盘 共享 文件 硬盘 nas ftp"
  },
  {
   "id": "下载",
   "order": 7,
   "keywords": "下载 磁力 bt 种子"
  },
  {
   "id": "容器",
   "order": 8,
   "keywords": "虚拟化 docker 容器"
  },
  {
   "id": "监控",
   "order": 9,
   "keywords": "监控 流量 统计 状态 温度"
  },
  {
   "id": "多媒体",
   "order": 10,
   "keywords": "音乐 影音 投屏"
  },
  {
   "id": "系统",
   "order": 11,
   "keywords": "重启 终端 权限 定时 屏幕"
  },
  {
   "id": "协议",
   "order": 12,
   "keywords": "接口 协议 拨号 隧道"
  },
  {
   "id": "主题",
   "order": 13,
   "keywords": "主题 界面 皮肤 外观"
  },
  {
   "id": "其它",
   "order": 14,
   "keywords": ""
  }
 ],
 "sources": [
  {
   "id": "immortalwrt-24.10",
   "name": "ImmortalWrt",
   "repo_url": "https://github.com/immortalwrt/immortalwrt",
   "branch": "openwrt-24.10"
  },
 
  {
   "id": "immortalwrt-master",
   "name": "ImmortalWrt",
   "repo_url": "https://github.com/immortalwrt/immortalwrt",
   "branch": "master"
  },
  {
   "id": "lede-master",
   "name": "LEDE",
   "repo_url": "https://github.com/coolsnowwolf/lede",
   "branch": "master"
  }
 ],
 "plugins": [
  {
   "id": "luci-app-homeproxy",
   "name": "HomeProxy",
   "desc": "基于 sing-box 的轻量代理，界面简洁。",
   "desc_en": "The modern ImmortalWrt proxy platform for ARM64/AMD64",
   "cat": "代理",
   "kind": "app",
   "origin": {
    "type": "builtin"
   },
   "deps": [
    "sing-box",
    "firewall4",
    "kmod-nft-tproxy",
    "ucode-mod-digest"
   ],
   "requires": [],
   "size_mb": 3.5,
   "rec": false,
   "tut": "在「服务 → HomeProxy」导入节点即可。",
   "tags": [],
   "hidden": false
  },
  {
   "id": "luci-app-openclash",
   "name": "openclash",
   "desc": "兼容 Clash 配置的代理客户端，内核体积较大。",
   "desc_en": "",
   "cat": "代理",
   "kind": "app",
   "origin": {
    "type": "builtin"
   },
   "deps": [],
   "requires": [],
   "size_mb": 9,
   "rec": false,
   "tut": "上传配置文件或订阅地址，并下载内核。",
   "tags": [],
   "hidden": false
  },
  {
   "id": "luci-app-passwall",
   "name": "passwall",
   "desc": "多节点、分流规则完整的代理工具。",
   "desc_en": "LuCI support for PassWall",
   "cat": "代理",
   "kind": "app",
   "origin": {
    "type": "builtin"
   },
   "deps": [
    "coreutils",
    "coreutils-base64",
    "coreutils-nohup",
    "curl",
    "chinadns-ng",
    "dns2socks",
    "ip-full",
    "libuci-lua",
    "lua",
    "luci-lib-jsonc",
    "microsocks",
    "resolveip",
    "tcping",
    "unzip",
    "ipt2socks",
    "kmod-nft-socket",
    "kmod-nft-tproxy",
    "kmod-nft-nat",
    "PACKAGE_$(PKG_NAME)_INCLUDE_Brook:brook",
    "PACKAGE_$(PKG_NAME)_INCLUDE_Haproxy:haproxy",
    "PACKAGE_$(PKG_NAME)_INCLUDE_Hysteria:hysteria",
    "PACKAGE_$(PKG_NAME)_INCLUDE_NaiveProxy:naiveproxy",
    "PACKAGE_$(PKG_NAME)_INCLUDE_Shadowsocks_Rust_Client:shadowsocks-rust-sslocal",
    "PACKAGE_$(PKG_NAME)_INCLUDE_Shadowsocks_Rust_Server:shadowsocks-rust-ssserver",
    "PACKAGE_$(PKG_NAME)_INCLUDE_Shadow_TLS:shadow-tls",
    "PACKAGE_$(PKG_NAME)_INCLUDE_Simple_Obfs:simple-obfs-client",
    "PACKAGE_$(PKG_NAME)_INCLUDE_SingBox:sing-box",
    "PACKAGE_$(PKG_NAME)_INCLUDE_tuic_client:tuic-client",
    "PACKAGE_$(PKG_NAME)_INCLUDE_V2ray_Geodata:v2ray-geoip",
    "PACKAGE_$(PKG_NAME)_INCLUDE_V2ray_Geodata:v2ray-geosite",
    "PACKAGE_$(PKG_NAME)_INCLUDE_V2ray_Geoview:geoview",
    "PACKAGE_$(PKG_NAME)_INCLUDE_V2ray_Plugin:v2ray-plugin",
    "PACKAGE_$(PKG_NAME)_INCLUDE_Xray:xray-core",
    "PACKAGE_$(PKG_NAME)_INCLUDE_Xray_Plugin:xray-plugin"
   ],
   "requires": [],
   "size_mb": 1.8,
   "rec": false,
   "tut": "装好后先添加订阅，再选择分流模式。",
   "tags": [],
   "hidden": false
  },
  {
   "id": "luci-app-privoxy",
   "name": "privoxy",
   "desc": "LuCI Support for Privoxy WEB proxy",
   "desc_en": "LuCI Support for Privoxy WEB proxy",
   "cat": "代理",
   "kind": "app",
   "origin": {
    "type": "builtin"
   },
   "deps": [
    "luci-lib-ipkg",
    "privoxy"
   ],
   "requires": [],
   "size_mb": null,
   "rec": false,
   "tut": "",
   "tags": [],
   "hidden": false
  },
  {
   "id": "luci-app-v2raya",
   "name": "v2rayA",
   "desc": "LuCI support for v2rayA",
   "desc_en": "LuCI support for v2rayA",
   "cat": "代理",
   "kind": "app",
   "origin": {
    "type": "builtin"
   },
   "deps": [
    "v2raya"
   ],
   "requires": [],
   "size_mb": null,
   "rec": false,
   "tut": "",
   "tags": [],
   "hidden": false
  },
  {
   "id": "luci-app-adblock",
   "name": "Adblock",
   "desc": "LuCI support for Adblock",
   "desc_en": "LuCI support for Adblock",
   "cat": "DNS 与广告",
   "kind": "app",
   "origin": {
    "type": "builtin"
   },
   "deps": [
    "adblock"
   ],
   "requires": [],
   "size_mb": null,
   "rec": false,
   "tut": "",
   "tags": [],
   "hidden": false
  },
  {
   "id": "luci-app-adblock-fast",
   "name": "AdBlock Fast",
   "desc": "AdBlock-Fast Web UI",
   "desc_en": "AdBlock-Fast Web UI",
   "cat": "DNS 与广告",
   "kind": "app",
   "origin": {
    "type": "builtin"
   },
   "deps": [
    "adblock-fast",
    "rpcd-mod-ucode"
   ],
   "requires": [],
   "size_mb": null,
   "rec": false,
   "tut": "",
   "tags": [],
   "hidden": false
  },
  {
   "id": "luci-app-arpbind",
   "name": "IP/MAC绑定",
   "desc": "LuCI support for ARP binding",
   "desc_en": "LuCI support for ARP binding",
   "cat": "DNS 与广告",
   "kind": "app",
   "origin": {
    "type": "builtin"
   },
   "deps": [
    "ip"
   ],
   "requires": [],
   "size_mb": null,
   "rec": false,
   "tut": "",
   "tags": [],
   "hidden": false
  },
  {
   "id": "luci-app-banip",
   "name": "banIP",
   "desc": "LuCI support for banIP",
   "desc_en": "LuCI support for banIP",
   "cat": "DNS 与广告",
   "kind": "app",
   "origin": {
    "type": "builtin"
   },
   "deps": [
    "banip"
   ],
   "requires": [],
   "size_mb": null,
   "rec": false,
   "tut": "",
   "tags": [],
   "hidden": false
  },
  {
   "id": "luci-app-ddns",
   "name": "动态 DNS",
   "desc": "LuCI Support for Dynamic DNS Client (ddns-scripts)",
   "desc_en": "LuCI Support for Dynamic DNS Client (ddns-scripts)",
   "cat": "DNS 与广告",
   "kind": "app",
   "origin": {
    "type": "builtin"
   },
   "deps": [
    "ddns-scripts"
   ],
   "requires": [],
   "size_mb": null,
   "rec": false,
   "tut": "",
   "tags": [],
   "hidden": false
  },
  {
   "id": "luci-app-ddns-go",
   "name": "DDNS-Go",
   "desc": "自动把公网 IP 解析到你的域名。",
   "desc_en": "LuCI support for DDNS-Go",
   "cat": "DNS 与广告",
   "kind": "app",
   "origin": {
    "type": "builtin"
   },
   "deps": [
    "ddns-go"
   ],
   "requires": [],
   "size_mb": 3,
   "rec": false,
   "tut": "打开 9876 端口，填写服务商密钥。",
   "tags": [],
   "hidden": false
  },
  {
   "id": "luci-app-https-dns-proxy",
   "name": "HTTPS DNS 代理",
   "desc": "DNS Over HTTPS Proxy Web UI",
   "desc_en": "DNS Over HTTPS Proxy Web UI",
   "cat": "DNS 与广告",
   "kind": "app",
   "origin": {
    "type": "builtin"
   },
   "deps": [
    "https-dns-proxy"
   ],
   "requires": [],
   "size_mb": null,
   "rec": false,
   "tut": "",
   "tags": [],
   "hidden": false
  },
  {
   "id": "luci-app-smartdns",
   "name": "SmartDNS",
   "desc": "多上游并发解析，选最快的结果。",
   "desc_en": "LuCI for smartdns",
   "cat": "DNS 与广告",
   "kind": "app",
   "origin": {
    "type": "builtin"
   },
   "deps": [
    "smartdns"
   ],
   "requires": [],
   "size_mb": 1.2,
   "rec": false,
   "tut": "勾选「重定向 53 端口」即可生效。",
   "tags": [],
   "hidden": false
  },
  {
   "id": "luci-app-unbound",
   "name": "unbound",
   "desc": "Unbound Recursive DNS Resolver Configuration",
   "desc_en": "Unbound Recursive DNS Resolver Configuration",
   "cat": "DNS 与广告",
   "kind": "app",
   "origin": {
    "type": "builtin"
   },
   "deps": [
    "unbound-daemon"
   ],
   "requires": [],
   "size_mb": null,
   "rec": false,
   "tut": "",
   "tags": [],
   "hidden": false
  },
  {
   "id": "luci-app-3ginfo-lite",
   "name": "模块",
   "desc": "LuCI JS Support for 3ginfo-lite",
   "desc_en": "LuCI JS Support for 3ginfo-lite",
   "cat": "网络",
   "kind": "app",
   "origin": {
    "type": "builtin"
   },
   "deps": [
    "sms-tool",
    "comgt",
    "kmod-usb-serial-option"
   ],
   "requires": [],
   "size_mb": null,
   "rec": false,
   "tut": "",
   "tags": [],
   "hidden": false
  },
  {
   "id": "luci-app-appfilter",
   "name": "appfilter",
   "desc": "LuCI support for OAF",
   "desc_en": "LuCI support for OAF",
   "cat": "网络",
   "kind": "app",
   "origin": {
    "type": "builtin"
   },
   "deps": [
    "appfilter"
   ],
   "requires": [],
   "size_mb": null,
   "rec": false,
   "tut": "",
   "tags": [],
   "hidden": false
  },
  {
   "id": "luci-app-bcp38",
   "name": "BCP38",
   "desc": "BCP38 LuCI interface",
   "desc_en": "BCP38 LuCI interface",
   "cat": "网络",
   "kind": "app",
   "origin": {
    "type": "builtin"
   },
   "deps": [
    "bcp38"
   ],
   "requires": [],
   "size_mb": null,
   "rec": false,
   "tut": "",
   "tags": [],
   "hidden": false
  },
  {
   "id": "luci-app-bmx7",
   "name": "bmx7",
   "desc": "LuCI support for BMX7",
   "desc_en": "LuCI support for BMX7",
   "cat": "网络",
   "kind": "app",
   "origin": {
    "type": "builtin"
   },
   "deps": [
    "luci-lib-json",
    "bmx7",
    "bmx7-json"
   ],
   "requires": [],
   "size_mb": null,
   "rec": false,
   "tut": "",
   "tags": [],
   "hidden": false
  },
  {
   "id": "luci-app-cd8021x",
   "name": "Content-Type: text/plain; charset=UTF-8\\n",
   "desc": "a wired IEEE 802.1x client for Luci",
   "desc_en": "a wired IEEE 802.1x client for Luci",
   "cat": "网络",
   "kind": "app",
   "origin": {